{"$defs":{"artifact_refs":{"items":{"$ref":"#/$defs/identity"},"maxItems":64,"type":"array","uniqueItems":true},"binding":{"additionalProperties":false,"properties":{"content_hash":{"$ref":"#/$defs/sha"},"id":{"$ref":"#/$defs/id"},"revision":{"maximum":9007199254740991,"minimum":1,"type":"integer"}},"required":["id","revision","content_hash"],"type":"object"},"id":{"maxLength":64,"minLength":2,"pattern":"^[a-z][a-z0-9_]{1,63}$","type":"string"},"identity":{"additionalProperties":false,"properties":{"content_hash":{"$ref":"#/$defs/sha"},"id":{"$ref":"#/$defs/id"}},"required":["id","content_hash"],"type":"object"},"integer":{"maximum":9007199254740991,"minimum":0,"type":"integer"},"reason_codes":{"items":{"pattern":"^[a-z][a-z0-9_]{1,63}$","type":"string"},"maxItems":64,"type":"array","uniqueItems":true},"sha":{"pattern":"^[0-9a-f]{64}$","type":"string"}},"$id":"https://world-forge.local/schemas/agent-execution-receipt.schema.json","$schema":"https://json-schema.org/draft/2020-12/schema","additionalProperties":false,"properties":{"activation":{"$ref":"#/$defs/identity"},"content_hash":{"$ref":"#/$defs/sha"},"execution_id":{"$ref":"#/$defs/id"},"failure_codes":{"$ref":"#/$defs/reason_codes"},"format":{"const":"world-forge.agent_execution_receipt"},"format_version":{"const":1},"grant":{"$ref":"#/$defs/identity"},"outcome":{"enum":["succeeded","failed","cancelled"]},"prompt_identities":{"$ref":"#/$defs/artifact_refs"},"receipt_id":{"$ref":"#/$defs/id"},"replay_support":{"const":"not_claimed"},"result_artifacts":{"$ref":"#/$defs/artifact_refs"},"runtime_binding":{"$ref":"#/$defs/binding"},"tool_invocations":{"items":{"additionalProperties":false,"properties":{"failure_codes":{"$ref":"#/$defs/reason_codes"},"invocation_id":{"$ref":"#/$defs/id"},"outcome":{"enum":["succeeded","failed","cancelled"]},"request_hash":{"$ref":"#/$defs/sha"},"result_artifacts":{"$ref":"#/$defs/artifact_refs"},"sequence":{"$ref":"#/$defs/integer"},"tool_id":{"maxLength":1024,"minLength":3,"pattern":"^[a-z][a-z0-9_]{1,63}(?:\\.[a-z][a-z0-9_]{1,63})+$","type":"string"}},"required":["invocation_id","sequence","tool_id","request_hash","outcome","result_artifacts","failure_codes"],"type":"object"},"maxItems":128,"type":"array"},"usage":{"additionalProperties":false,"properties":{"cached_input_tokens":{"$ref":"#/$defs/integer"},"cost_minor_units":{"anyOf":[{"$ref":"#/$defs/integer"},{"type":"null"}]},"currency":{"anyOf":[{"pattern":"^[A-Z]{3}$","type":"string"},{"type":"null"}]},"duration_ms":{"$ref":"#/$defs/integer"},"input_tokens":{"$ref":"#/$defs/integer"},"output_tokens":{"$ref":"#/$defs/integer"}},"required":["input_tokens","output_tokens","cached_input_tokens","duration_ms","cost_minor_units","currency"],"type":"object"}},"required":["format","format_version","receipt_id","execution_id","activation","grant","runtime_binding","prompt_identities","tool_invocations","result_artifacts","usage","outcome","failure_codes","replay_support","content_hash"],"title":"Immutable Agent Execution Receipt v1","type":"object","x-world-forge-agent-harness-coherent":true}
