{"activation":{"content_hash":"69fe43c3662aa6e984f97160d23f8217e9f7428bbc8dc5af04326c189bed79ce","id":"activation_01"},"content_hash":"cd4234b80b0417b805c412ecb6aa47999c5b3c2c57a99b9616dcb03b29fbc1a7","execution_id":"execution_01","failure_codes":[],"format":"world-forge.agent_execution_receipt","format_version":1,"grant":{"content_hash":"530b45d0edc29fdd98430e3f972f6f43b8be406cb0aca8fb92004a19595c4e22","id":"grant_01"},"outcome":"succeeded","prompt_identities":[{"content_hash":"4444444444444444444444444444444444444444444444444444444444444444","id":"prompt_01"}],"receipt_id":"receipt_01","replay_support":"not_claimed","result_artifacts":[],"runtime_binding":{"content_hash":"3333333333333333333333333333333333333333333333333333333333333333","id":"harness_runtime","revision":1},"tool_invocations":[],"usage":{"cached_input_tokens":0,"cost_minor_units":null,"currency":null,"duration_ms":0,"input_tokens":0,"output_tokens":0}}